{"adaptation_rules":["below 70% on a stage check: redo fundamentals of that stage before advancing","two clean stage checks: skip repeated drills of the same type","fatigue day: replace drills with question-path review only"],"daily_tasks":["evening 1-2: single-table drills 30 min plus 15 min recall","evening 3: aggregation practice","evening 4: join exercises plus weekly self-check"],"diagnosis":{"likely_misconceptions":["JOIN always duplicates rows","GROUP BY returns one row per table"],"prerequisites":["basic spreadsheet column filtering","English keywords reading"]},"question_path":["What does one result row represent here?","Which table does each column come from?","What happens to rows without a match?"],"schema_version":"socratic_study_plan_output.v1","self_assessment":["explain GROUP BY output row meaning in one sentence","predict join result size before executing","redo one failed exercise from memory a week later"],"stages":[{"practice":"rewrite 5 given queries on a sample table","self_check":"solve 8 of 10 filter tasks without notes","skills":["filter and sort confidently","write WHERE with multiple conditions"],"stage":"single-table fluency"},{"practice":"build 3 summary queries on the sample database","self_check":"predict row counts before running","skills":["COUNT/SUM/AVG with GROUP BY","explain grouped row meaning"],"stage":"aggregation"},{"practice":"combine orders and customers in 4 exercises","self_check":"explain each result row's origin","skills":["inner join two tables","spot fan-out duplication"],"stage":"joins"}]}